,recall,sent
24669,ХS оказался огромный. Заказывала себе так он на XS мужскому размеру соответствует. ,negative
27203,"не заказывайте товар .
некачественный,продавец не вернул деньги",negative
53383,Материал футболки не самый лучший - сплошная синтетика. Сильно просвечивают.,neautral
14830,"ткань не из самых приятных, толсковка тёплая.",negative
77229,"отлично, класс, в Московскую область за 20 дней",positive
14891,"Заказывала оранжевый и серый ( материалы разные) оба свитера синтетика. Размер S очень большой как М или L даже а рукава короткие.А оранжевый заказывала М он огромный,даже на плечах не задерживается. Носить не буду ",negative
25903,"Не пришел мой заказ,продавец вернул деньги",negative
69217,"Платье подошло по размеру, ставлю четверку, за то что рукова узкие,размер у меня 44- 46 , заказывала L ",positive
65001,пришол заказ быстро. сшито аккуратно.,positive
15174,"Товар не отправил спустя 3 недели, открыла спор, должны вернуть деньги",negative
70795,"брала xxl и перестраховалась взяла ещё и xxxl и та и то ок :) застегнула на 9месячный живот обе.. ношу 48-50 рус.170 вешу 92 сейчас ..куртка нормальная ,рекомендую )",positive
13842,Заказ доставлен с задержкой в 6 дней.Когда Новый год прошел...,negative
14312,"Кофта тонкая, не для зимы это точно, только на теплую осень. В целом не доволен, продавец на контакт не идет.",negative
20536,"Продавец отменил доставку, на связь не вышел даже после моего прямого вопроса ему по поводу доставки товара",negative
6971,я вопше  не получила куртку и продавец продлили спор до новава года зачем мне нужно эта куртка с таким образом,negative
13766,Я заказала ХХL но блуза не соответствует этому размеру. Очень маленькая для 48 размера.,negative
873,плюс быстрая доставка и отслеживание трека. цвет не чисто белый с желтизной как будто застиран. для простой футболки высокая цена!,negative
1513,"Товар не поступил,сезон прошел.",negative
38858,"Продавец отправил не тот цвет(((( я заказывала розовый а пришёл  бежевый. Куча ниток, несостыковки в кружеве. За быструю доставку +",neautral
74048,"Доставлен был быстро в Россию, но с нашей почтой беда, так что получала я посылку после 1,5 месяцев ожидания в Ростове-на-Дону. О топе. Ткань - синтетика, но довольно-таки качественная, плотная, но не настолько, чтобы ходить без бюстгальтера. Цвет яркий, насыщенный. По размеру: на груди 90см сидит плотно, так что барышням с бОльшими объемами стоит подумать. Так, за свои деньги это хороший продукт.",positive
12674,"Заказ ишёл 14 дней.Ношу S , заказала М.Подошло по размеру.Но этот свитер носить не буду, ткань вся просвечивается,нитки торчат, буквы такие, что после стирки свитер весь окрасится.",negative
35846,Мне не очень понравился! Ожидала большего(((,neautral
38491,"Халат маломерка. На 50р выписывала xxxl. Запаха практически нет, карманы пришиты рядом с планкой, материал какой-то плюшевый, смотрится дешево, длина до колена. На картинке гораздо симпатичнее. Единственное, думаю, что халат теплый. Можно конечно придумать какую-нибудь застежку( пуговицы или кнопки)",neautral
4601,"жена заказала заказ так и не пришол, или его вообще не отправили",negative
18052,"футболка пришла с пятном, продавец попросил не открывать спор, тк пятно по его мнению, обязательно отстирается. не отстиралось, деньги вернули,  качество футболки чистая синтетика,никакого хлопка там нет",negative
39607,"В этом магазине купила 2 вещи. Одна куртка очень понравилась и хорошо подошла по размеру. Эта куртка очень велика не только внизу, так как размер бедер меньше чем размер бюста, велика и в груди. Хотя про размер я спрашивала у продавца.   Эти две куртки одного размера.",neautral
60012,"Хорошая водолазка, но очень тонкая, меня сильно обтянула! на параметры 93-60  хотелось бы на размер больше!",positive
32286,"Кофта совсем не тонкая как заявлена(тонкий трикотаж),материал больше похож на ластик изнаночная сторона на  флисе,швы не аккуратные особенно впереди нитками стянуто.Покупка не обрадовала",neautral
21981,"Такая синтетика!!! Не пахнет, но нормально работающий утюг, на минимальной мощности сжег рубаху.  ",negative
79544,кофта огромная на 46-48,positive
72915,мало.общалась с продавцом пока товар еще был не отправлен  .посоветовал размер но при отправлении не изменил его.обидно.а вообще кофта супер.качество на высоте.заказала больше размером.надеюсь быстро отправят,positive
69792,Пуховик отличного качества!! До Кирова приехал за 21день.Спасиьо продавцу за внимательность и заботу!! Очень подробно объяснил как нужно выбрать размер! Отдельное спасибо за подарочек! Я очень довольна!!Рекомендую !!!,positive
69658,Неплохая кофточка за свои деньги. Я довольна. Кот смешной вышел на фото),positive
24257,"пришла куртка ,оказалась мала и  не очень тёплая ,маленькая. Я открыла спор , продавец попросил отметить и сказал ,что вернёт деньги и он очень сожалеет. спустя месяц деньги не вернул. я спршиваю , а он отвечает 15 дней уже 3 раз",negative
33491,"Delivery was very fast, but product quality not good for such price",neautral
55694,"4ХL ПОДОШЁЛ НА 48 РАЗМЕР ХОРОШО( ОГ=96 СМ) , НЕ ОБТЯГИВАЕТ ПЛОТНО. РАЗМЕРОМ ДОВОЛЬНА. ПОСТАВКА СВОЕВРЕМЕННА",positive
3573,"К сожалению полоски на легнинсах совсем не тянутся, притягивают ноги (",negative
59348,"Товар пришёл в хорошей упаковке, в идеальном состоянии. Была приятно удивлена, тем что там оказались чашечки.",positive
68729,Спасибо большое продавцу,positive
4840,"Платье синтетика, форму не держит, пришло грязное. Полное разочарование",negative
66660,замечательное шапка! Я советую,positive
20164,"Заказ вообще не пришёл ! Пошла навстречу продавцу и отменила первый спор,понадеявшись ,что обещания продавца выполнятся ,но,к сожалению,нет. Потеряла полтора месяца . ",negative
70073,Заказ не пришел.,positive
4078,"жесть..они не тянутся..ткань плотная..спереди выше, чем сзади)))...жесть",negative
30115,"ткань просто ужас! все просвечивает, на s не похоже, будто m!( из-за этого сидит ужасно,пришла с пятном. крайне не довольна!",neautral
71043,"офигенная, приятная, удобная",positive
49678,Скажу что продавец отличный!,neautral
36053,"Кофта пришла с не большим пятном, которое не отстиралось. Спор открывать не стала.",neautral
68754,"рубашка очень понравилась,плотный хлопок,пошив качественный.только с размером промахнулся,на 48р-р взяла XXL.большевата.вот почитала отзывы что после стирки немного садится,надеюсь может чуток сядет)))доставка быстрая.рекомендую продавца!!!",positive
1576,Net pugovic,negative
11545,товар не получила!,negative
74007,отличное платье. хорошее качество. приятно к телу,positive
27666,Качество не очень ,neautral
5258,"платье с пятнами, которые вообще не отстирываются",negative
72346,"Качество отличное,нитки не торчат,швы ровные. Доставка в Москву  две недели. В магазинах такая вещь стоит 2 тыс,поэтому однозначно рекомендую)",positive
76936,"спасибо продавцу, пришла посылка очень быстро! отличный комплект за эти деньги, хорошее качеств, нитки не торчат!",positive
8955,"Получила пальто с браком, во многих местах отсутствует наполнитель, в итоге в этих пустотах образуются складки и перекос ткани. При чем наполнитель отсутствует от подола, до пояса и представьте себе какая складка по всей длине и сморщена ткань. Написала продавцу, он предложил мне 10 долларов, но для ремонта вы сами знаете, что это мизер, но я согласилась получить хоть что-то а он  видимо просто на до многой посмеялся, больше не отвечал на вопросы. Хотела открыть спор, от расстройства на нервной почве случился стресс, а я уже в возрасте, несколько дней не вставала с постели, просто отказали ноги. Не стала связываться, пусть будет на их совести. Не советую вам этого продавца, в принципе пальто не плохое, но мне не повезло. Да, и очень слабые кнопки.",negative
34942,"смотрится очень дешево, маловат, хотя на размер больше заказывала",neautral
57995,Хорошие джинсы. доставка быстрая. спасибо за подарок!,positive
9238,"заказ шел очень долго,пришла рубашка черного цвета,хотя заказывала красную,рукава короткие,и сама малость маловата,хотя заказала размер М",negative
20204,XL максимум на 44 размер!!! Мне оказался мал. Если честно то он больше одноразовый. Чашечки ооочень маленькие. Платьем точно не назвать. Короче обдумайте . ,negative
2888,"пр0довец нё вёрнул дёнъги,п0этому пищу так(не ст0ит з@к@зыва@ь)",negative
55730,"Хорошая юбка, продавец очччеень общительный) дошла быстро до ДВ немножечко похоже на обычный кусок ткани, но за такие деньги очень даже дорого смотрится;) любительницам длинных юбок от талии до колена советую)на рост 165 и вес 59 подойдёт))",positive
71578,Доставка быстрая (даже быстрее чем я ожидала). Продавец общительный. Колготки отличные.,positive
12609,"Купила размер L она на 40-42, очень маленький . По материалу голая синтетика, ужас.",negative
83204,"Хорошая шапочка, качество  Доча очень довольна! Закажу еще другого цвета! Рекомендую!",positive
44782,"резинки до меня так и не доехали, продавец вернул деньги, за это только  три звезды",neautral
42896,"На фотографии полувер полностью закрывает талию модели и ещё есть возможность растянуть его ниже, фактически полувер только до талии",neautral
60249,футболка очень красивая Тошто я хотела,positive
14176,"Низ комплекта мне велик, верх маленький. Создаётся полное ощущение что это части разных комплектов. К ткани претензий нет, швы простой оверлок .",negative
1670,"Продавец отправил заказ быстро, но увы до меня не дошел, ушел в другой город. Продавец отвечал сразу, извинился и деньги за заказ вернул",negative
40496,"штаны плохо тянутся по размеру не подошли , брала размер s на свой 42й малы",neautral
33057,На картинке цвет свитера яркий ... а в живую более тусклый,neautral
23657,"ужасная блузка,рукава задом наперед пришиты.Материал хуже марли.",negative
78718,подарок,positive
25078,размер не совпадает.маломерка .48 размер идёт как на 44,negative
56006,"Приятный на ощупь кардиган,хорошее качество, но на мой размер S и рост 158 см оказался большеват ",positive
14737,"Шарф отличный, но цвет продавец перепутал!",negative
5213,"Заказ отправлен не был. Продавец о задержке не предупредил. Лишь после истечения срока для отправки заказа в ответ на мое обращение продавец сообщил, что нужного размера нет. В итоге заказ отменила.",negative
76263,"Шикарная! Размерная сетка совпадает, мягкая, швы ровные, нитки не торчат, котик вообще выше всяких похвал! Не покупка, а сплошной восторг!",positive
61817,"На 46 размер 92/76/94 село хорошо. Чуть туговато в рукаве, но не критично. Рост 176 поколено. Не колется. Только для хорошей фигуры без пузика.",positive
62889,"шапка отличная за такую цену, не пахнет, продавца рекомендую",positive
21272,"Так и не дошла посылка , по треку вроде даже до города нашего доползла, но там и канула в небытие! Чья вина, хрен его знает, но товар не получен!!!",negative
6906,"Перед тем как оформить заказ тщательно изучила отзывы,но не смотря на большее количество положительных своего заказа я так и не дождалась. Продавцом указан срок доставки до 28 дней, по истечении 50 дней заказ так и не пришёл.  Очень жаль. Продавец не очень общительный.он Ожидаю возврат средств",negative
51103,"Заказ пришел за месяц.  Немного стягивает резинка на спинке. За счет этого стянута грудь.  Придется распороть и удалить резинку. Кружево на лифе пришито не симметрично, вид не красивый.
 Из плюсов - тонкая, приятная к телу ткань",neautral
40800,"размер великоват,цвет темнее,чем на фото.",neautral
30971,"Все вроде качественно, как в описании,
 НО ...вырезы для рук, проймы очень глубоки и видно бюстгалтер сбоку.",neautral
26973,"пришло быстро. цвет приятный, фото соответствует, за это звезды. но топ кривой - низ криво обрезан, смотрится перекошенным, проймы разного размера на пол сантиметра, нитки торчат. Очень ждала топ и очень расстроилась",negative
80793,"Куртка пришла за 16 дней в краснодарский край, пошив хороший, полностью соответствует описанию, размер в соответствии с таблицей",positive
18392,"Выше я уже написала про доставку, и про то как продавец кормил завтраками. В общем либо продавцу нужно срочно обращать внимание с какими транспортными компаниями он работает, иначе покупателей он растеряет. Заказывать здесь больше ничего не буду. Решила чтобы ребёнок и сестра походили осень в бомбере,славо богу хоть в октябре пришёл заказ!",negative
7256,"товар не пришел, продавец не продлил срок и не вернул деньги!!!!",negative
24920,"Товар не пришёл. Проверяла не почте, просто обман. ",negative
49541,"Одни легинсы пришли в размер, вторые на два размера меньше :(( спор открывать не стала, отдала подруге, в целом товаром довольна, жаль что невнимательно собирали заказ",neautral
5831,"пальто и близко не шерсть, материал напоминает вельвет, с переливом, оооочень тонкое, не соответствует описанию вообще. я так его ждала и ооочень расстроилась. пошив- мешок, даже фото не буду выкладывать",negative
27022,Товар был оформлен 2017.04.05 Трек не отслеживался. На сегодняшний дент 2017.08.28  В итоге не товара не денег.,negative
5337,"маломерят очень сильно на 44, видимо 50 надо было заказыть",negative
13078,"сначала они мне очень понравились. одела один раз и прям на улице они разорвались в самом неприличном месте. ткань причтная, но очень слабо пошиты. причем меня не очень сильно обтягивали. у меня 42 размер. а эти лосины налезают и на несколько размеров больше. я растроена.",negative
11610,Товар так и не пришёл. Трек не отслеживается. Деньги вернул алиэкспресс.,negative
51024,"Думала, что заказала тонкий свитер, а пришла водолазка- лапша... причём синтетика",neautral
66227,качество замечательное.Доставка 3 недели в подмосковье.Размер соответствует.Очень довольна.Спасибо.На грудь 96 размер XXL  как раз.,positive
45437,"брала S, жмет в плечах и горловина.
продавец долго не отправлял товар, поэтому наверно пришла за 2 месяца (праздники же в РФ)",neautral
11115,"лосины хороши,но зелёные полосочки все портят...",negative
28211,очень красиво смотрится. на об 90 и от 67 заказала xs матовые. подошло.  жаль что сразу появились трещинки. на коленях и выше. одноразовая вещь. не рекомендую. с продавцом не общалась.,neautral
13543,"продавец написал,что отправил ,а оказалось,что нет нужного цвета. три недели вели дискуссию.наконец деньги вернули.",negative
40727,"М ,большое ,надо было S. ОГ 96 ,РОСТ 160 ДЕВЧОНКИ!!!",neautral
4437,не добросовестный продавец!!!!!!!!!!!,negative
64599,"22 дня с момента заказа (4 обработка + 18 доставка RETS-Express). Брал жене за 756р. (с купоном продавца). Платье пошито аккуратно, лишних ниток нет, строчка ровная. Единственный косяк - белые полоски в районе подмышек стыкуются криво (но по понятным причинам это не особо критично). Ткань - чистая синтетика, тянется хорошо, присутствует слабый глянцевый эффект (поэтому на фотках блики). На 90-65-95 S-ка села отлично, нигде не давит, в районе разрезов не тянет. На рост 171 см по длине - до щиколотки. Жена очень довольна. Продавца и товар рекомендуем.",positive
66503,"очень красивый костюм, можно и в офис и на выход, цвет благородный, на свой рост 161 см, убрала длину юбки на 10 см, так как длина миди это не моё. товар доставили прямо до квартиры, что очень порадовало, огромное спасибо продавцу и за комплект и за сервис)фото выкладываю без юбки-еще
 ушивается,как будет готова выложу ещё фото",positive
49106,Так себе..  Дешёвая кофточка..,neautral
