,recall,sent
16006,Ткань ужасная,negative
69528,"Ткань тонкая, тоньше, чем джинс, тянется средне. Комбез легкий. Летом можно носить. Параметры 92-69-92, Рост 164, размер сел.",positive
81227,Очень хорошие.,positive
21790,товар не отслеживался и в итоге не пришел. Но продавец вернул деньги,negative
70585,"Прикольные,как всегда.заказывала уже все цвета,очень нравятся",positive
31476,"Цвет вообще не тот, что на картинке. Леггинсы пришли откровенно золотого цвета.) ",neautral
20151,Не по размеру! ,negative
65420,клевая)  в размер,positive
37784,"Товар не пришёл, деньги вернули",neautral
31466,пропорции,neautral
28464,///,neautral
27795,мала,neautral
9915,"ужасный товар и плохой продавец, не хотел спор принимать. Хорошо арбитраж признал спор действителен",negative
22384,Описание не соответствует.,negative
2077,"Большие в талии и бедрах, короткие по длине.",negative
72323,"чуть велика,можно было размер S брать смело. на вырост. прекрасная кофта❤️❤️❤️",positive
644,Заказ не получил. Продавец вернул только 2 доллара. 40 центов прикарманил,negative
41017,"Материал не понравился(( будто из простыни бабушкиной(( не тянется, на 48 маловато((",neautral
35125,"Качество не очень, прозрачный, швы так себе. Есть что-то похожее на стринги. Единственное пришел быстро, но не отслеживался.",neautral
36596,на платье большое жирное пятно,neautral
65205,"это гораздо больше, чем я ожидала! сбылась моя мечта об огромном теплом кардигане, ещё и с маленьким подарком от продавца :)
доставка очень быстрая, в общем, я довольна как слон))",positive
22666,"Товар очень плохо пахнул. Оказался на несколько размеров меньше заявленного. Тут же постирала ( вручную)- вся краска стекала, что вода была чёрной , белая сторона соответсвенно была полностью окрашена. Буду просить возврата средств ",negative
82099,Продавец общительный советую. заказом довольна,positive
59256,Шарф большой и мягкий. Доставка долгая,positive
22591,"рубашка села идеально.  ношу 40 42, заказала s. единственный недочет-пришла с дыркой.  можно зашить, но сам факт. уже неприятно . а так полностью соответствует описанию продавца.",negative
23999,"не ахти качество...доставка ужасная , пришлось потратить день , что бы найти ячейку куда бросила курьерская служба CDEK это пальто",negative
59440,"футболка отличная, продавцу спасибо",positive
79333,"Качество отличное! За такую цену просто сказка! Размер L на ОГ 92 немного туговато, но в процессе носки возможно растянется)",positive
52231,на рост 170 коротковато.,neautral
573,"Размер не соответствует таблице.  Меньше размера на три. Думаю, что на мой 46 российский нет соответствующего по их сетке. Зря выброшены деньги. Долго не отправляли.",negative
48350,Товар пришёл оперативно. Соответствует описанию. Упаковка добротная. Но с браком. Видимо  уже положили с дырой,neautral
46653,"Синиетика…причем неприятная( 
а так штаны как штаны. Но ткань мерзкая.",neautral
3208,"все классно мне все нравится , пришло быстро даже не ожидала )",negative
43088,"Доставка быстрая до Москвы,размер подошол  брала s на размер 40.Но нека на картинке тоненький просвечивающий материал,конешно расстроило ждала плотный свитер осень зима!А так очень хорошенький но на весну.с продавцом необщаюсь.",neautral
40849,Товар соответствует . Заказыва S подошла идеально,neautral
35885,"размер XL талия 68см, бедра 88см, длина по внутреннему шву 70см, а от талии длина 95см. на мои бедра 103 см и талию 93см налезло впритык, можно было бы посвободнее.",neautral
7855,"качество не такое как на картинке,пришла маленькая (
заказом не доволен (((",negative
38995,"Заказывала в августе, получила в конце октября! Продавец отправил товар в последний день! Домой доставил курьер, сама футболка хорошая, размер соответствует! С продавцом не общалась. Какой службой продавец отправил, что столько времени она шла - вопрос((. Если бы не Доставка в 2 месяца с лишним, заказывала бы ещё, а так подумаю!",neautral
54358,После стирке леняет.  Платье на один раз.,neautral
76769,"Отличный костюм) на параметры 175, 86-63-93  подошёл размер S.",positive
65201,Очень быстро доставлено до Москвы. Ребенок доволен.НЕ хлопок. Носить можно.,positive
79173,заказ получила принёс курьер куртка классная большое спасибо.,positive
77547,"Платье понравилось, качество хорошее, приятное к телу, на размер 42-44 заказала s, немного широковато в талии, продавцу спасибо за быструю доставку!)",positive
26159,"продавец даже не отправлял, без объяснения причин. вернула деньги через спор",negative
47313,очень неприятный запах,neautral
55381,"супер доставка, очень довольна, буду заказывать ещё) спасибо)",positive
61465,"отличное качество. не угадала с размером, но это сама виновата.",positive
39793,шла около трех недель. трек отслеживается. заказала L оказалась совсем маленькая. маломерит. Я думаю и xl не подойдет. качество на 4. кое где торчат нитки. Ну цена соответствует качеству.,neautral
3310,Вообще фигня какая-то ,negative
60761,Л на 40-42 ,positive
50162,тлрт,neautral
46205,"короткие рукава,не соответствуют размеру",neautral
7701,"не заказывать у данного продавца, не мог долго отправить, потом совсем отправка была отменена. разочарована очень.",negative
60289,"Куртка пришла за 2 недели, качество хорошее. Брала на март, тк животик растёт. Решила перестраховаться и выбрала максимальный размер) Так на рост 171см можно на 1-2 меньше выбрать.",positive
11622,"After washing, there was a sharp smell, everywhere threads, not denim at all.",negative
70050,не очень. крой какой то непонятный. на вороте изнутри клубок ниток пришит. карманы как то сильно высоко пришиты,positive
23379,посылка не пришла!продавец вернул деньги,negative
82355,Куртка супер но шла очень долго,positive
62476,Очень быстро. Спасибо. Рекомендую,positive
14203,"к сожалению вместо майки пришел комплект непонятного белья, шло очень долго больше месяца, да и заказ долго обрабатывался, в итоге открыла спор, который решился в мою пользу, деньги пока не вернулись. ждём",negative
37733,Куртка оказалась размер 56 на рост 170.  Мой размер 52 рост 150. Мне велика.  Я буду уменьшать куртку. Вышивка на спинке сжата. При вышивании плохо натянули ткань. Куртка смотрится не очень красиво.,neautral
19507,"заказала М ,прислали XXL   с размером на ярлыке М. доставили за три недели. но очень обидно , что так ошиблись с размером.",negative
56889,"качество супер, единственное не подошло по размеру,малость велико,на свои параметры ОГ 87 и ОБ 92 заказала М-ку",positive
16011,"Заказала размер М, (ношу размер s) Юбка оказалась очень маленькой, на ребёнка 12 летнего(( я расстроена и не понятно куда её теперь деть... ",negative
79191,посылка пришла быстро все понравилось кофточка по размеру спасибо прадовцу,positive
1749,два раза заказ от этого продавца не пришёл. причём второй раз заказ даже не был отправлен через полтора месяца.,negative
35543,Не такое как на фото. Смотриться не очень. Не стоит этих денег,neautral
25420,"Очень короткая, будто села после стирки. До Москвы дошло за 2 недели",negative
77590,"Пуховик отличный. Все строчки аккуратно прошиты. Нитки не торчат. Мой рост 170, вес 73 кг заказала 4ХL. Подошёл идеально. На пуховике указан размер 54, мой размер 50. Заказывала 11.11.2017, получила 06.12.2017. Продавцу спасибо. Рекомендую.",positive
70761,к сожалению цвет отличается. а в остальном на самом деле он больше бежевый. А в остальном куртка неплохаяю,positive
82009,Супер´ я 44—46 покупала на беременность´ хватит до конца срока думаю´ супер качество плотненькая ,positive
30836,"маленький капюшон, и слабые резинки на манжетах
в целом, не плохо, заказывать не буду больше",neautral
31599,"Шорты хорошие, но товар шел очень долго. качество и цвет устраивают. спасибо!",neautral
40016,"Сверху капрон,это разочаровало. купила два цвета разных размера. Сравнивая размер M больше XL, но когда надеваешь, XL свободнее, но узковато для женщины 52 размера. Цвет серый хороший, а синий...темный, ближе к черному. Большой минус в верхнем слое.",neautral
3280,"Заказ не пришел,спор я открыть забыла,так что осталась и без денег и без товара,не рекомендую этого продавца,так как не проверяет дошел ли товар к покупателю.",negative
69791,"Заказ шёл больше месяца за это минус. В остальном джинсы супер, соответствует описанию, и размер и длина в точку, заказывала 29 на мой 46-48 можно в принципе и побольше, но джинсы эластичные думаю растчнутся и будут нормальные. Советую.",positive
52934,Тонкая синтетика. ,neautral
23787,"не хлопок !!!!!!!,синтетика!!!!!!",negative
43390,"Качество хорошее, но вот размер не соответствует",neautral
60732,очень красивая кофта!,positive
41769,"Слишком долго продавец обрабатывал и отправлял заказ, где-то неделю.Товар маломерка, берите на размер больше.",neautral
62866,"Пижама хорошая, как на картинке. Дочь очень давольна. На рост 151 заказали s, подошло хорошо. Но шло долго, почти два месяца.",positive
4792,"заказала 4хl,пришли...в итоге мало,дай бог что бы на русский 42 налезли,подруге отдам ...очень сильно маломерят",negative
41443,"очень средненькое качество, не стоит даже этих денег",neautral
65815,"Быстрая доставка, очень понравилось ",positive
48144,"Товар не пришёл,но продавец вернул деньги ",neautral
29712,"к сожалению товар не пришел, продавец вернул деньги",neautral
62114,суперское платье.качество понравилось. длинное,positive
69577,"кофта классная, рукав по длине и она теплая",positive
24196,"Товар не пришёл,трек не отслеживался.Один раз продавец продлил защиту.Во второй не собирался.Я открыла спор за 2 дня до истечения срока.Продавец просил закрыть спор и подождать чего-то и это после завершения срока защиты товара. Али спор закрыли в мою пользу,буду ждать денег.Жаль.",negative
78651,"отлично,спасибо продавцу",positive
25287,"жилет пришел с дыркой. спор открыть не удалось потому что фото дырки не прикрепляется к спору, а без фото спор не откывается. продавцу писала, что товар бракованный, он ответил чтобы я его переслала другому покупателю за его счет. но кому нужен жилет с дыркой?????",negative
27470,"цвет свитера отличается от фото, не бежевый, а желтый,при этом цвет неравномерный, а с разводами,  торчат нитки.",negative
76474,"хорошая кофта,приличное качество) до Москвы дошла всего за 15 дней! трек отслеживался, от процавцв в подарок получила резиночку для волос",positive
37100,"Ткань приятная, но лобковица сшита, а на спине молния не очень глубокая-еле влезла. В целом боди по размеру, но способ одевания смущает особенно если идти в туалет))",neautral
57094,"Нууу, юбка своих денег не стоит, всегда носила штаны 42-44, так юбку заказала Л, немного давит, ткань не очень приятная, пришла быстро",positive
29318,"Товар пришёл с браком( неровный шов, носить можно но к низу получаеться заужено, не очень удобно",neautral
29813,короткие,neautral
32128,"На мой размер S, их S большой оказался. Сидит не так плотно.",neautral
58236,"Упаковка класс, качество супер ",positive
23542,на футболке пятна,negative
46849,"заказ шел очень долго, 2 месяца, хотя другие заказы с али приходят в среднем за 3 недели. продавец отвечает на сообщения с неохотой, пишеш он отвечает только через 2-3 дня.",neautral
24470,"Качество очень плохое, реальная стоимость 300 руб, но ни как не больше 1000. Вязка прозрачная, в общем ужас.",negative
14809,ничего не прислали. нет шортов,negative
7224,"товар не получил, но деньги вернули.",negative
58819,Качество на отлично! Берите не пожалеете!,positive
54049,"Недовольна заказом. Сшита нормально,размер на параметры 85-58-89 подошел хорошо,но рукава широкие, к продавцу претензий нет. Но на фото на модели вообще не похоже,ткань слишком плотная синтетика,сидит колом,как рубашка для психбольных. Блузка пришла с небольшими пятнами. До носки я ее постирала вручную,как написано на бирке,отдельно от всего-так во время стирки стали выходить какие то пачкающие коричневые шеворушки,после стирки остались разводы в районе горловины. Очень расстроена,носить в принципе можно,но мне не нравится как она сидит",neautral
24383,"не стоит верить в иллюзию, что можно выбрать размер! халат без маркировок и очень маленький. рукава 3/4, хотя по задумке полной длины. запросил возврат - деньги вернули и только потому не 1 звезда. продавец отправил не сразу и не отвечал на сообщение после покупки.",negative
63901,Оотлично),positive
51295,Размер прислали на 11 летнего ребёнка ,neautral
41152,"Штаны как на картинке. Тянуться хорошо, блестят. но! девочки, кто ростом выше 165 штанишки будут короткими. у меня XL размер и рост 175, до щиколотки 12 см....это ппц
по объему село идеально.",neautral
62542,супер,positive
55878,Шикарное платье! Размер подошел. Доставка быстрая. Спасибо,positive
35300,"Товар не пришел, продавец вернул деньги.",neautral
14365,"Товар так и не пришел,заказывала 18.04.17 ,прошло 2,5 месяца",negative
29987,"Чуть великоват, хоть и писали, что надо заказывать на размер больше, заказала по своему размеру. Немного отличается от фото. ",neautral
62673,пальто просто замечательно село как надо(как по мне сшито) Один минус что лёгкий ну это не так страшно.продавцу респект буду заказывать ещё. курьерская доставка прямо на работу,positive
69639,"на российский 46й чуть маловат,но не критично конечно",positive
41759,"не получила, деньги вернули , но белье у них классное",neautral
74914,"Заказала размер XL сверив по моим параметрам в описании товара, но он мне оказался очень мал.Сам по себе мягкий,красивый свитер,но,на данном товаре нет прикрепленной бирки размера нечего, что указывает размер данного изделия, там  нет.Единственно отдельно кинутая бирка в пакет без размера.Открыла спор, за несоответствие товара описанию,служба алиэкспресс вернула половину стоимости.За  это ставлю 4 .у продавца судя по отзывам покупателей товар одного размера(стандарт).Зачем вводить людей в заблуждение  я незнаю.Свитер подарю кому-нибудь.",positive
75781,Good quality.,positive
77444,"Мягкая ,приятная,запаха нет",positive
59898,"товар получен своевременно, соответствует описанию, размер немного не соответствует, продавца рекомендую.....",positive
21229,"Отвратительное качество, на обоих плечах дыры, боковые швы перекошены. На спине горловина оттопыривается, сама блуза косая, даже стыдно выкладывать фото. В общем, сильно ждала и очень разочарована.",negative
67211,"все устроило. ог 120, от 100.",positive
35212,"Тонкая ткань, пижама не стоит этих денег, но по размеру, спасибо хот за это",neautral
38869,"товар соответствует описание. продавец вежливый. очень долгая доставка на север. заказывала 15.06, пришел 16.06. аргументируют это тем, что сотрудничают с дешевой транспортной компанией.",neautral
61098,"доставка до Санкт-Петербурга заняла 2 недели, продавец положил маленький подарочек,ни запаха ни торчащих ниток,ровные строчки,пока не стирала, ткань приятная на ощупь!",positive
47585,не подошел размер на 44. налезли до середины бедра,neautral
33288,"Получил заказ с хорошим качеством, но размер немного мал.",neautral
36354,"Написано на этикетке состав 85% хлопок, 10% нейлон, 5% полиэстер. По ощущениям это не так, хлопок практически не чувствуется, больше похоже на полиэстер со спандексом.",neautral
76363,"чудесный шарф, пришёл за 2 недели)) мягкий и приятный)) буду заказывать еще)",positive
37281,"брак... рукава кривые, немного порвано и нитки торчат",neautral
74354,"Заказ доставили быстро, качество хорошее.",positive
