,recall,sent
68674,Качество отличное! Буду заказывать ещё.,positive
45796,Материал правда тонкий...Доставка быстрая спасибо,neautral
23019,вообще не соответствует размеру. очень сильно маленькие как на ребенка,negative
7810,seller not ship,negative
33732,"На российский 48-50 XL мал, таблица продавца неверна. Качество не плохое, смесь хлопка.",neautral
49081,"кофта сама хорошая,размер l на 42 русский свободно сидит как на фото.рукава длинные, но вот манжет распорот был по шву и шаварышки уже собираться начали",neautral
20760,Товар не получила. Сегодня проверяла на почте. Спор открыть не успела. Товар не отслуживался. Очень расстроилась. ((((((,negative
25398,Товар не пришёл. Продавец мурыжил 43 дня. В итоге в спор вмешался али экспресс. Деньги вернули,negative
48579,Не соответствие размерной сетки. Нужно брать на три размера больше.,neautral
42422,"Леггинсы неплохие, только минус основная ткань вискоза, электризуются. Я до этого
 брала на хб основе, они были лучше.",neautral
25713,"Доброе время суток! Заказала лосины, ждала месяц, а пришла открытка и подвеска. Открыла спор. Мне отказали в возврате денег. Продавец просил закрыть спор и подождать еще немного. Я ответила, что ждать не намерена и подарок можно было положить с основным заказом. А теперь жду от вас номер отслеживания, по которому я удостоверюсь, что мой заказ в пути. Естественно мне он ничего не отправил. Я этого продавца НЕ РЕКОМЕНДУЮ.",negative
51232,"Нервущимися и не пахнет, 20ден, одноразовые. Даже дня не прожили ",neautral
67984,5++++++,positive
66573,"Очень очень довольна куртка хорошая на прохладную осень продавец общается отлично когда заказывала был праздник но продавец все равно отвечал, доставку заказывала платную ,доставка полторы недели учётом праздников ! рекомендую!!",positive
26557,"Товар даже не отправлен, деньги вернул Али",negative
3421,"Заказал 11 ноября 2017. Судя по трекингу, товар находится в стране назначения. В Литве. А я заказывал в Россию. Срок защиты покупателя не продлили. Заказ закрылся сам-собой. В общем, товар не получил. Ну... хоть дайте отзыв напишу.",negative
36613,Платье среднего качества.  Пришло быстро.,neautral
76253,"Юбка полностью соответствует фото, суперская! Всем советую",positive
65018,Девочки. Куртка просто бомба. так как я и хотела. тонкая. мягкая. лёгкая. всего 600 грамм. И очень тёплая. советую всем. Только имейте ввиду что она маломерка.,positive
77750,"Не столь плотные как хотелось ,но хорошие ",positive
64453,Рубашка супер! Чуть села после стирки. ,positive
43640,"я конечно читала в отзывах, что майка коротковата, но она ОЧЕНЬ короткая, смотрится просто смешно, как будто детская, носить невозможно даже дома. хотя по объемам мне подошла. мой рост 170, размер s. если ваш рост такой же, то вам тоже будет коротка.",neautral
68033,"Посылка шла пять недель в Алтайский край. Качество достойное, супруга довольна.",positive
23917,"Это конченный продавец. Мало того что товар не пришёл, так ещё этот пидор на сообщения не отвечает и деньги не вернул, ебаный китаец гори в аду",negative
46234,после стирки платье покрылось катышками,neautral
51912,"Свитер мягкий, очень приятный, но заказанный размера М оказался по факту где-то XS, и цвет не такой насыщенный как на фото.",neautral
71296,"за 2 недели пришла посылка , с учётом праздников! просто супер!!! джинсы с запахом, после стирки запах прошёл. сели идеально. размер 28. мои параметры: рост 170, 94-71-94. спасибо!!",positive
53386,"К сожалению, 3XL на рос. 50 размер очень мала. Может, кому-нибудь подарю.",neautral
26575,"отвратительный продавец!!! ни товара, ни денег!!! сволочи!!!",negative
21336,"Добрый вечер, уважаемые поставщики.
Я жду свою посылку  3 месяц-это 60 дней и , похоже, не дождусь.Оценить точность  описания не могу, поскольку посылки нет, зато общение с продавцом и срок доставки оцениваю на 1 звезду. 

Справедливости ради хочу заметить, что это первый раз при покупке на вашем сайте.",negative
52451,просвечивается,neautral
30504,Некачественный пошив.Товар не отслеживается.Размер подошел.,neautral
51463,не подошел размер,neautral
60417,"Отличные брюки.Брала для прогулки с сыном.Идеальны для проблемной фигуры(у меня остался живот после родов,и синтепоновые брюки от костюма одеть не смогла).Выбирала размер по отзывам.В итоге 32 подошел идеально.Можно и поддеть под низ еще,но не толстое.",positive
48457,"размер большой, ткань тонкая.",neautral
10003,"Товар, который я оплатила, был отправлен продавцом не на моё имя и не мой адрес. Писала об этом продавцу , мне ни кто не ответил. Я очень сильно не довольна. Больше у этого продавца ни чего заказывать не буду. Товар мне так и не прислали. ",negative
8219,The quality of fabric is awful. Total plastic. Doesn't worse its money,negative
11432,"мне не понравилась!на фото рисунок гораздо ярче.размер мне большеват
в целом блузка блеклая и не интересная",negative
20485,"Заказали в августе,получили в ноябре.очень долгая доставка",negative
60337,"отличная юбка, продавец отправил быстро, доставка 2 недели. качество супер, лента в цвет. единственное был небольшой запах. резинка тянется.",positive
67690,"Класс!!! Мне на мои 98/78 чуть свободно. Но и фасон такой. Цвет розовый совпадает с фото. Очочоч симпатичная блузка. Трек отслеживался, с продавцом не общалась. Доставка за 3 недели до Казани. Рекомендую блузку и продавца. ",positive
29307,"уж не знаю, что ""суперского"" нашли в этих штанах. единственный + : хорошо утягивают в талии, высокая резинка. штанины все топорщится складками, думаю вне зависимости от размера.",neautral
2328,"Товар не пришёл, продавец кормил ""завтраками"" . Закрыл спор и деньги не вернули",negative
1766,размер не соответствует действительности . Хотела бы вернуть деньги.,negative
82925,"Качество хорошее, но штаны очень уж короткие",positive
81304,"топ пришел за месяц и 4 дня в Свердловскую область. качество нормальное, хлопок. при моем росте 155 он мне до пупка. рада, что приобрела такую вещь. спасибо :3",positive
60630,Юбочка классная по размеру спасибо.,positive
80023,"Хорошее качество и приятная цена. Быстрая доставка, прям домой.",positive
52436,"Заказывали футболку с надписью Шуга (SUGA), но что-то пошло не так, была прислана футболка с надписью Чон Гук (JUNG KOOK)",neautral
5793,"очень долго ждала посылку, но заказ так и не пришёл..",negative
22503,"качество ужасное, сшито криво, соответствует цене, поэтому спор не открывала.",negative
48994,"Товар шёл долго , по размеру подошла ",neautral
82254,"кофта хорошая за свои деньги.но почему-то я решила что мне должен подойти размер L на мой S. мой рост 162,вес 53. что и требовалось доказать-кофта велика. Ну ничего,отдам маме,думаю подойдет. спасибо продавцу,быстро доставил,с курьером.",positive
64175,"Хороший свитер, но думала будет длиннее, немного закрывает пупок, мой рост 173. Доставка быстрая, курьером лично в руки.",positive
20895,"Заказ не пришёл,продавец отказывался возвращать деньги,арбитраж решил спор",negative
1678,вы самые бессовестные продавцы  уже 2месяца   (с20 ноября) не возвращаете деньги  за отказ от товара,negative
44663,"кофта симпатичная,но казалось материал другой,а это синтетика,вдобавок еще и короткая и совсем в облипку,хотя по параметрам должна подойти.. жаль конечно..",neautral
14296,"на рост 165 и 42 размер, ракова широкие и короткие, сама водолазка тоже короткая, по качеству синтетика, в общем я недовольна ",negative
24393,"заказ ждала 3 месяца, так и не пришел. спасибо продавцу , что вернул деньги.",negative
57458,отличный товар..качественно!),positive
38159,"бежевое просвечивает,на 46 L великовато,носить не буду",neautral
13934,"Размер просто детский, я заказала XL, но я так поняла,  что у них вобще один размер, он подходит на XS,  если не меньше, вобще маленькая! Вобщем я открыла спор и хочу вернуть половину денег, так как носить не буду. Мой размер 42, рост 158см и вес 47кг и то эта кофта в сильный обтяг, ну а качество неплохое.",negative
57725,"Очень красивые, но маленькие. На мой 36 еле-еле",positive
5370,"так ничего не пришло, продавец шел на контакт, в итоге вернули деньги, немного не приятно, но за честность спасибо",negative
45656,"Очень сильно маломерят, берите размера на два больше. А так качество - синтетика, на раннюю весну само то.",neautral
16187,"Заказ шел месяц, упакована хорошо. Неприятный запах есть. Куртка на теплую зиму, открытая шея, капюшон как будто пришит только для красоты, сзади ало что прикрывает, карманы пришиты на разных уровнях(криво).",negative
37358,"перед покупкой проконсультировалась с продавцом, написала свой рост 170, меня убедили что все подойдёт... результат очень короткие! примерно две ладони!",neautral
70490,"Шло 2 месяца. Но виноват не продавец, посылка застряла на таможне (или что то того) Китая. При общении с продавцом, шел на контакт, сам продлил защиту покупателя. Сшито хорошо, супруге понравилась, и смотрится отлично.",positive
41127,"Заказ шёл ОООЧЕНЬ долго! Заказывала больше, чем за месяц, чтобы получить новому году и одеть эту юбку на новогоднюю ночь. Но куда там!! Продавец долго тянул с отправкой, да и шёл заказ долго. получила заказ больше чем через полтора месяца. И если бы было, чего ждать! Открываю посылку-восторг! Юбка пышная, мягкая, супер! Одеваю, кручусь перед зеркалом и замечаю узелок на втором слое юбки. Развязываю его, а там дырка! Огромная дырка, размером с ладонь! И Ее очень видно! Теперь я эту юбку никуда не могу одеть! И ради этого я ждала полтора месяца? Продавец бессовестный, хотел скрыть это от меня, завязав дырку в узелок! Открыла спор. Одобрили возврат части суммы денег. Если бы не эта дырка, то юбка была бы просто роскошной. Но ещё раз ждать полтора месяца я не готова. ",neautral
76337,"Беру второй раз, все просто великолепно!",positive
57638,"Товар в Екатеринбург за месяц. Куртка хорошего качества, ткань приятная на ощупь, цвет как на картине.  размер S заказала на 12 лет рост 152-154, подошел хорошо. На осень, весну.",positive
69296,"очень быстрая доставка в Воронеж! 1.08 продавец отправил товар, 10.08 уже подучили. все супер.",positive
8871,Заказ не пришел. И деньги не возвращают уже 20 дней.,negative
18051,"очень долго шли, думала, что колготки, а это носки ",negative
64831,"Шапочка очень хорошая, мягкая и тёплая, у нас такая рублей 800 стоит. Спасибо продавцу.",positive
9635,куртка пришла короткие рукава не советуб,negative
81109,"быстрая доставка, заказала 27.07, получила 11.08. хорошая юбка, размер L на от 70 об 99 идеально, рост 168",positive
70439,"рукава правда длинные , слишком!)",positive
15825,"ткань тонкая, веревочки ободронные, кофту только в мусоре, ткань воняет химией, не покупайте, открыла спор,  а они меня обманули и не вернули",negative
76748,"Блузка плотная, рисунок яркий, ткань больше хлопковая. Длина на рост 175 до попы. Рукава не коротки. Все швы и строчки ровные, нитки не торчат. На объем 90-74 подошел L. Заказ отправили на следующий день. До Ульяновска дошел за 2 недели. При распаковке присутствовал запах, но после стирки выветрился.",positive
49612,"Блузка для мутантов. Первый раз заказала на размер больше - пришло нормального кроя. Эта же пришла просто тяп-ляп пятилетнего ребенка. Все торчит и косит. Думала дело в размере, но в ателье выяснилось, что она пошита неправильно. Больше не закажу. Не рекомендую.",neautral
56527,"Пуховик пришел в Калугу за 23 дня. Замечательно! Сшито все очень аккуратно.Все молнии работают. На 52 русский брала 4XL. Сел четко по размеру. На рост 165 немного ниже колена. Пух распределен равномерно в простроченных квадратиках. Красивый. Мех,конечно, не такой пушистый,как на фото,но смотрится хорошо.Цвет скорее коричневато-золотистый, красивый, лучше,чем на фото. Спасибо продавцу! Смотрится дороже,чем стоит. Рекомендую.",positive
180,не пришли. возврат денег при вмешательстве али только,negative
69522,"Сшить прекрасно, брала xxl, на мой 50 размер мала, надо худеть",positive
42366,"платье очень маломерит!! размер М на русский 40 максимум.и ткань хоть и мягкая но вообще не тянется(( я разочарована.оно очень хорошо смотрится, но с размерами беда.не соответствует размерной сетке(",neautral
24342,К сожалению в Самару не дошло ((((,negative
46042,"Пришла после свадьбы доставка месяц, простла платнкю. Рукава короткие, спереди топорщится крючки не держат. Брала л на свой 44 подошла если б не рукава. Писец ... ",neautral
39355,"ужас, не советую, смотрится отвратительно",neautral
35778,"Швы не очень ровные , размеры не совпадают с реальными",neautral
65273,"Футболки странного качества.. синтетики там конечно конкретно.. надпись - наклейка, может сойти в любой момент, да и на размер s пришлось брать l и то.. с натяжкой, а так, в общем если что, для дома они пойдут.. пришли довольно быстро",positive
4583,"Заказывала размер L, российский ношу 46-пришёл товар очень маленький, на подростка наверно",negative
45673,"качество неочень,в бедрах велико,носить стремно",neautral
77676,"На ОГ 110, От 85, Об 114 просто супер, мужу понравилось",positive
7791,заказ не пришел!,negative
62541,"пришло за 10 дней,паеток меньше чем на фото,но тоже норм.Сам топ синтетика",positive
80695,отличного качества кофточка. мягкая. по размеру отлично подошло. буду еще заказывать только в другом цвете. продавец умничка. отправил очень быстро. спасибо.,positive
67746,"Куртка (ветровка) классная, сидит хорошо, вес 52, рост 170. Куртка очень понравилась. Молния узкая, металл, дочка хочет перешить на широкую. Но это косяк производителя. Продавец-молодец! Получили через 14 дней в Москве. Рекомендую ",positive
64018,"Очень красивый костюм. На размер 42-44 подошёл. Цвет насыщенный. Целиком ещё не стирала, но одно пятно пришлось, вода покрасилась, при носке тело не подкрасилось. Запаха не было. Доставка быстрая.",positive
77156,"пришли быстро, правда брюки синтетические, хотела в них по жому ходить, но похоже буду ходить в них на тренеровку",positive
35549,"Товар пришел быстро. На рост 160 ( размер 44-46) заказала м. Подошел размер, но после 1 раза  по шву образовалась дырка.... а так неплохие колготки! Но тонковатые.",neautral
53504,Тоненький зауженный а покрой хороший доставка 1 месяц до Москвы,neautral
41123,Неточность в описании товара. А так всё аккуратно.,neautral
6756,"Халат оказался очень маленький , как рубашка:(((( Цвет не соответствует",negative
4889,нечего не получилась слишком не хороший 4месяцев ждала нету......но деньги обратно дали молодец!,negative
82979,качество соответствует цене.на рост 165 коротие.сшити хорошо.на худенькую девочку лет 12.,positive
2336,"4 месяца прошло, а труселей так и нет. Просила отправить с отслеживанием, т.к. Почти 10штук взяла, а продавец послал без отслеживания, мудак. Раньше вроде норм был, испортился. Знала бы, что он такой плохой, не делала бы у него заказ. Ужасный продавец.",negative
72643,Товар соответствует описанию . Спасибо,positive
80564,"Поскольку я обожаю уютные мягкие халаты, конечно же, не смогла пройти мимо этого. Заказывала в сером цвете, с мордочкой ослика на капюшоне. Пожалуй, этот то приятное исключение, когда даже взрослые могут позволить себе побыть детьми: халат действительно классный, ощущаешь себя в нем очень комфортно и дурашливо. Мягкий до невозможности, теплый и удобный. Правда, материал довольно толстый, поэтому слегка визуально полнит в застегнутом виде. Но это мелочи в сравнении с тем, насколько он приятный. Рекомендую!",positive
