,docid,url,title,modified,lastmodtime,type,domain,status,part,bloc,tags,image_url,pubdate,text,rightcol,snippet
37,943868,https://lenta.ru/news/2020/01/01/papa/,Ударивший по рукам паломницу Папа Римский объяснился,1577881395,1577881395,1,1,0,0,2,[2],https://icdn.lenta.ru/images/2020/01/01/15/20200101152209256/detail_462fefcfa44b42a7480af86871348d2d.jpg,1577881395,"Фото: Vatican Media / Reuters Папа Римский Франциск, оттолкнувший и ударивший по рукам женщину, извинился и объяснил, что все нередко теряют терпение. Его слова передает «Интерфакс». «Я прошу прощения за то, что подал плохой пример», — сказал он в обращении к верующим. Понтифик во вторник, 31 декабря, общался с людьми на площади Святого Петра. Одна из женщин схватила Франциска за руку из-за заграждения, когда тот проходил мимо, в ответ он несколько раз ударил ее по рукам. После этого к паломнице подошла охрана.","По его словам, все нередко теряют терпение","Фото: Vatican Media / Reuters Папа ..., что все нередко теряют терпение. Его слова передает «Интерфакс». «Я прошу прощения за то, что подал ...», — сказал он в обращении к верующим."
38,943870,https://lenta.ru/news/2020/01/01/vodyanova/,Наталья Водянова рассказала о скором замужестве,1577882774,1577882774,1,1,0,0,47,[156],https://icdn.lenta.ru/images/2020/01/01/15/20200101154412745/detail_a32feacb3ab8a20c97c6786e91649113.jpg,1577882774,"Фото: Асатур Есаянц / РИА Новости Российская супермодель Наталья Водянова рассказала о скором замужестве. Фотография с французским миллиардером Антуаном Арно опубликована в ее Instagram-аккаунте. В подписи к снимку модель отметила, что прошедший год был прекрасным и запоминающимся. «Не терпится отметить следующий год с нашими любимыми», — добавила она. В комментариях подписчики, заметившие кольцо на безымянном пальце модели, спросили у Водяновой, действительно ли речь идет о свадьбе. Она эту информацию подтвердила. О своем романе с Арно, с которым у модели двое общих детей, Водянова сообщила в 2011 году после развода с британским аристократом Джастином Тревором Беркли Портманом.",Модель опубликовала фотографию с миллиардером Антуаном Арно,"Фото: Асатур Есаянц / РИА Новости ... рассказала о скором замужестве. Фотография с французским миллиардером ... опубликована в ее Instagram-аккаунте. В подписи к снимку модель отметила, что ... год был прекрасным и запоминающимся."
39,943871,https://lenta.ru/news/2020/01/01/bolshunov/,Российский лыжник Большунов выиграл гонку преследования на «Тур де Ски»,1577884560,1578073598,1,1,0,0,8,[37],https://icdn.lenta.ru/images/2020/01/01/16/20200101160440543/detail_9c2f0344e402fa98539c62728e9a5cc7.jpg,1577884560,"Александр Большунов Фото: Алексей Филиппов / РИА Новости Российский лыжник Александр Большунов финишировал первым в гонке преследования на многодневке «Тур де Ски» в итальянском Тоблахе. Об этом в среду, 1 января, сообщает корреспондент «Ленты.ру». 23-летний Большунов преодолел 15-километровую дистанцию за 38 минут 14,9 секунды. Вторым стал другой россиянин Сергей Устюгов (+13,7 секунды), третьим — финн Ииво Нисканен (+24,8 секунды). 31 декабря Устюгов, Большунов и Иван Якимушкин заняли весь пьедестал в гонке свободным стилем на третьем этапе «Тур де Ски». Победил Устюгов, вторым финишировал Якимушкин, Большунов стал третьим. Устюгов лидирует в общем зачете «Тур де Ски». Вторым идет Большунов с отставанием в 27 секунд. Третий — норвежец Йоханнес Клэбо, он уступает Устюгову 37 секунд. Клэбо является действующим чемпионом многодневки, которая продлится до 6 января. ","23-летний спортсмен преодолел 15-километровую дистанцию за 38 минут 14,9 секунды.","Александр Большунов Фото: Алексей ... «Тур де Ски» в итальянском Тоблахе. Об этом в среду, 1 января, сообщает корреспондент «Ленты.ру». 23-летний Большунов преодолел 15-... дистанцию за 38 минут 14,9 секунды."
40,943872,https://lenta.ru/news/2020/01/01/bloodmatch/,После дружеского футбольного матча в тюрьме погибли 16 заключенных,1577884847,1577884847,1,1,0,0,2,[4],https://icdn.lenta.ru/images/2020/01/01/16/20200101161359189/detail_2fe9057df84cfc646571614110cfb2cc.jpg,1577884847,"Фото: Daniel Becerril / Reuters В тюрьме в мексиканском штате Сакатекас члены конкурирующих картелей Гольфо и Лос-Сетас провели дружеский футбольный матч, переросший в конфликт. Об этом сообщает Mirror. Конкурирующие группы были вооружены, драка продолжалась несколько часов. В результате инцидента 15 человек погибли на месте, еще один скончался в больнице. Сотрудники тюрьмы обнаружили на месте происшествия четыре единицы огнестрельного оружия, куски арматуры, ножи и заточки. У тюрьмы дежурили 20 машин скорой помощи. После произошедшего у одного из арестованных заключенных нашли оружие. Отмечается, что беспорядки произошли через день после того, как сотрудники тюрьмы изымали у заключенных оружие, алкоголь, наркотики и телефоны.",Драка продолжалась несколько часов,"Фото: Daniel Becerril / Reuters В тюрьме ... футбольный матч, переросший в конфликт. Об этом сообщает Mirror. Конкурирующие группы были вооружены, драка продолжалась несколько часов."
41,943877,https://lenta.ru/news/2020/01/01/vladik/,Появилось видео сожжения символа года за 670 тысяч рублей во Владивостоке,1577887728,1577887728,1,1,0,7,1,[4],https://icdn.lenta.ru/images/2020/01/01/17/20200101170502631/detail_9aed84f2294e688eca7d8b063ddd01e6.jpg,1577887728,"Фото: ИА PrimaMedia Появилось видео сожжения во Владивостоке символа 2020 года — новогодней мыши. Кадры, снятые очевидцами, опубликованы в Telegram-канале издания «Подъем». При этом не уточняется, загорелась мышь от петарды или ее подожгли. Фигуру мыши, которая стояла на центральной площади Владивостока, но была сбита автомобилистом, сожгли  в новогоднюю ночь. Конструкция с символом года обошлась в бюджету в 670 тысяч рублей. Местный водитель врезался в фигуру еще 14 декабря, после чего она упала. С тех пор и до новогодней ночи мышь лежала на центральной площади.",Фигуру сожгли в новогоднюю ночь,"Фото: ИА PrimaMedia Появилось видео ... символа 2020 года — новогодней мыши. Кадры, снятые очевидцами, опубликованы в Telegram-канале издания «Подъем». При этом не уточняется, загорелась мышь от петарды или ее подожгли."
42,943878,https://lenta.ru/news/2020/01/01/yard/,Россиянин выиграл в лотерею миллиард рублей,1577887903,1577887903,1,1,0,0,9,[42],https://icdn.lenta.ru/images/2020/01/01/17/20200101170707878/detail_b03495fdc5d2b2876b4913809ea8df5c.jpg,1577887903,"Фото: pixabay.com Житель Москвы выиграл в лотерею «Русское лото» миллиард рублей. Об этом сообщает «Российская газета» со ссылкой на пресс-службу «Столото». Издание отмечает, что это первый в истории России случай розыгрыша миллиарда рублей. Праздничный тираж состоялся 1 января, в нем приняли участие более 53 миллионов лотерейных билетов. Выигрышный купон был куплен в Москве за 100 рублей. Имя победителя пока неизвестно. Его пригласили за выигрышем в столичный лотерейный центр. В декабре сообщалось, что жительница американского города Вашингтон, округ Колумбия, неправильно заполнила лотерейные билеты и разбогатела на 100 тысяч долларов (6,2 миллиона рублей). Перина Гейнс (Perina Gaines) купила два лотерейных билета DC5 и случайно выбрала не ту комбинацию чисел, которую планировала. Она решила ничего не менять, и в результате каждый билет принес ей 50 тысяч долларов (3,1 миллиона рублей).",Это первый в истории России случай розыгрыша подобного джек-пота,"Фото: pixabay.com Житель Москвы выиграл ... лотерею «Русское лото» миллиард рублей. Об этом сообщает «Российская газета» со ссылкой на пресс-службу «Столото». Издание отмечает, что это первый в ... случай розыгрыша миллиарда рублей."
43,943869,https://lenta.ru/news/2020/01/01/chalov_chelsea/,Нападающий ЦСКА Чалов заинтересовал «Челси»,1577889000,1579790610,1,1,0,0,8,[236],https://icdn.lenta.ru/images/2020/01/01/17/20200101172505321/detail_bd3e39de925fb771a89d29f468963f0b.jpg,1577889000,"Федор Чалов Фото: Алексей Филиппов / РИА Новости Лондонский «Челси» заинтересован в покупке нападающего московского ЦСКА Федора Чалова. Об этом сообщает британский Daily Express. Лондонский клуб хочет подписать Чалова в ближайшее трансферное окно. За 21-летнего футболиста готовы предложить 20 миллионов фунтов стерлингов (23,6 миллиона евро). Другим претендентом на форварда является «Брайтон». Чалов — воспитанник ЦСКА. В нынешнем сезоне он выходил на поле в 27 матчах во всех турнирах, забил шесть мячей и сделал пять передач. В прошлом сезоне нападающий стал лучшим бомбардиром Российской премьер-лиги, записав на свой счет 15 голов в 30 матчах. Летом 2019-го Чаловым интересовался другой клуб Английской премьер-лиги «Кристал Пэлас». Лондонцы готовы были заплатить за форварда 27 миллионов евро, но ЦСКА не устроило это предложение.",Футболист может перейти в лондонский клуб в ближайшее трансферное окно,Федор Чалов Фото: Алексей Филиппов / РИА ... московского ЦСКА Федора Чалова. Об этом сообщает британский Daily Express. Лондонский клуб хочет подписать Чалова в ближайшее трансферное окно.
44,943875,https://lenta.ru/news/2020/01/01/aplbernley/,Новичок АПЛ одержал выездную победу и покинул зону вылета,1577889060,1577900972,1,1,0,0,8,[236],https://icdn.lenta.ru/images/2020/01/01/16/20200101165908735/detail_b929f17ee9fa0ff0e7fa85dcdb2d23ff.jpg,1577889060,"Фото: Jason Cairnduff / Reuters «Астон Вилла» на выезде обыграла «Бернли» в матче 21-го тура Английской премьер-лиги (АПЛ). Об этом сообщает корреспондент «Ленты.ру». Встреча прошла в среду, 1 января, и завершилась со счетом 2:1 в пользу гостей. На 27-й минуте бирмингемцев вывел вперед Уэсли. Через 14 минут Джек Грилиш удвоил преимущество «Астон Виллы». На 84-й минуте Крис Вуд отыграл один мяч. Победа позволила новичку АПЛ «Астон Вилле» набрать 21 очко и покинуть зону вылета, выйдя на 16-е место. «Бернли» имеет в активе 24 очка и находится на 14-й позиции. В следующем туре «Астон Вилла» 12 января на своем поле примет «Манчестер Сити». Бернли днем раньше на выезде встретится с Челси.",«Астон Вилла» со счетом 2:1 обыграла «Бернли»,"Фото: Jason Cairnduff / Reuters «Астон ...-го тура Английской премьер-лиги (АПЛ). Об этом сообщает корреспондент «Ленты.ру». Встреча прошла в среду, 1 января, и завершилась со счетом 2:1 в пользу гостей."
45,943876,https://lenta.ru/news/2020/01/01/chelseawonbright/,Гол ударом через себя лишил «Челси» победы в матче АПЛ,1577889180,1577901667,1,1,0,7,8,[236],https://icdn.lenta.ru/images/2020/01/01/17/20200101170644361/detail_0c3c6a4a408868fc73ca78291c8e56f8.jpg,1577889180,"Фото: Dylan Martinez / Reuters «Челси» на выезде сыграл вничью с «Брайтоном» в матче 21-го тура Английской премьер-лиги (АПЛ). Об этом сообщает корреспондент «Ленты.ру». Встреча прошла в среду, 1 января, и завершилась со счетом 1:1. Первый мяч на 10-й минуте забил капитан синих Сесар Аспиликуэта. На 84-й минуте Алиреза Джаханбакш ударом через себя восстановил равенство. «Челси» набрал 36 очков и остается на четвертом месте в чемпионате. «Брайтон» имеет в активе 24 очка и находится на 13-й позиции. В следующем туре «Челси» 11 января на своем поле примет «Бернли». «Брайтон» в тот же день на выезде сыграет с «Эвертоном».",Синие на выезде со счетом 1:1 сыграли с «Брайтоном»,"Фото: Dylan Martinez / Reuters «Челси» ...-го тура Английской премьер-лиги (АПЛ). Об этом сообщает корреспондент «Ленты.ру». Встреча прошла в среду, 1 января, и завершилась со счетом 1:1."
46,943879,https://lenta.ru/news/2020/01/01/no_congratulations/,Ким Чен Ын отказался поздравлять корейцев с Новым годом,1577889900,1577957616,1,1,0,0,2,[1],https://icdn.lenta.ru/images/2020/01/01/17/20200101174220966/detail_3c9a3bf082a0d8d832efad599c8b3ee1.jpg,1577889900,"Фото: Виталий Аньков / РИА Новости Лидер Северной Кореи Ким Чен Ын отказался от ежегодного поздравления своего народа в новогоднее утро. Вместо этого на корейском телевидении показали декабрьское заседание Центрального комитета Трудовой партии КНДР с участием Ким Чен Ына, передает Bloomberg. На мероприятии северокорейский лидер, в частности, заявил, что больше не связан обязательствами моратория на ядерные испытания и анонсировал новые виды стратегических вооружений. Агентство отмечает, что Ким Чен Ын ежегодно выступал с новогодними обращениями с 2013 года. Эту традицию заложил его дед Ким Ир Сен в 1940-х годах. «Год назад, когда дипломатия между Кимом и [президентом США Дональдом] Трампом выглядела более многообещающей, северокорейский лидер отказался от формальностей, чтобы произнести свое новогоднее обращение», — пишет Bloomberg. Ранее Ким Чен Ын заявил, что вскоре Северная Корея покажет новый разработанный вид стратегического оружия. По его словам, США по-прежнему настроены враждебно по отношению к КНДР, поэтому Пхеньяну необходимо более активно разрабатывать стратегические вооружения. Госсекретарь США Майкл Помпео заявил, что Вашингтон будет «глубоко разочарован» в случае отказа Северной Кореи от моратория на атомные испытания и тесты межконтинентальных ракет.",Вместо этого на корейском телевидении показали декабрьское заседание Трудовой партии КНДР,"Фото: Виталий Аньков / РИА Новости Лидер ... своего народа в новогоднее утро. Вместо этого на корейском телевидении ... Ким Чен Ына, передает Bloomberg. На мероприятии северокорейский лидер, в ... новые виды стратегических вооружений."
47,943880,https://lenta.ru/news/2020/01/01/naftogaz/,«Нафтогаз» объявил о завершении отделения оператора ГТС Украины,1577890757,1577890757,1,1,0,0,4,[7],https://icdn.lenta.ru/images/2020/01/01/17/20200101175857669/detail_0dc0ecb6efcbc38980667043d2d769e6.jpg,1577890757,"Фото: Стрингер / РИА Новости Отделение оператора газотранспортной системы (ГТС) Украины от группы «Нафтогаз» полностью завершено. Об этом в своем Facebook-аккаунте написал глава компании Андрей Коболев. Он отметил, что «Нафтогаз» перестал быть акционером оператора ГТС и стал его клиентом. Коболев также добавил, что Украина выполнила норму Третьего энергопакета ЕС и доказала, что является надежным союзником. Ранее на Украине заявили о начале транспортировки газа в ЕС по новому контракту с «Газпромом». В ГТС отметили, что в Евросоюз уже поступили первые кубометры топлива по новому транзитному контракту с Россией. Отныне уже по европейским правилам в межгосударственных точках. ГТС работает в штатном режиме», — говорилось в сообщении. Россия и Украина подписали пятилетний контракт на транзит газа 30 декабря после четырех дней переговоров. Соглашение заключено по принципу «качай или плати», то есть «Газпром» обязуется прокачивать минимальный объем. В 2020 году он составит 65 миллиардов кубометров, а затем — по 40 миллиардов.","По словам Андрея Коболева, «Нафтогаз» стал клиентом ГТС","Фото: Стрингер / РИА Новости Отделение ... группы «Нафтогаз» полностью завершено. Об этом в своем Facebook-аккаунте написал глава компании Андрей Коболев. Он отметил, что «Нафтогаз» перестал ... оператора ГТС и стал его клиентом."
